511,Rabbit Hill Energy Storage Project,Electro-chemical,Electro-chemical,Lithium-ion Battery,Operational,"This project appears to be delayed.  The Rabbit Hill Energy Storage Project, located in Georgetown, Texas, is a joint project between Ormat Technologies and Alevo to build, own and operate the energy storage system. Ormat will own and fund the majority of the Rabbit Hill energy storage project and under the terms of the agreements, will provide engineering, construction services and balance of plant equipment. The project will consist of three Alevo GridBank inorganic lithium ion energy storage systems and six Parker-Hannifin 890- GTB Power Conversion Systems (PCS). Alevo will also provide ongoing management and operations and maintenance services for the life of the project.  The 10 MW project will consist of three GridBank enclosures and will provide fast responding regulation services (FRRS) as an open market participant in the Electric Reliability Council of Texas (ERCOT), an independent system operator that manages the flow of electric power to Texas customers. The project represents an evolution of the Texas market, which has more wind installed than any other state and has a rapidly expanding base of installed solar energy projects.",10000.0,,,,30.633261800000003,-97.68,,"Electric Energy Time Shift, Frequency Regulation, Renewables Energy Time Shift, ",Georgetown,Texas,United States,30.03.2016,31.12.2016,,,ERCOT,Georgetown Utility Systems,Public Owned,,,,0.0,,0.0,0.0,,,DD.18.YYYY 17:18:44,0.0,0.0,0.0,0.0,0.0,0.0,1.0,0.0,0.0,0.0,1.0,0.0,0.0,0.0,0.0,0.0,0.0,0.0,0.0,1.0,0.0,0.0,0.0,0.0,0.0,0.0,0.0,0.0,0.0
512,Batwind - Statoil,Electro-chemical,Electro-chemical,Lithium-ion Battery,Operational,"A new battery storage solution for offshore wind energy will be piloted in the world’s first floating wind farm, the Hywind pilot park off the coast of Peterhead in Aberdeenshire, Scotland. Batwind will be developed in co-operation with Scottish universities and suppliers, under a new Memorandum of Understanding (MoU) signed in Edinburgh on 18 March between Statoil, the Scottish Government, the Offshore Renewable Energy (ORE) Catapult and Scottish Enterprise.",1000.0,,,,57.508123,-1.78,,"Renewables Capacity Firming, ",Peterhead,Aberdeenshire,United Kingdom,18.03.2016,01.01.2018,,,,,,,,,0.0,,0.0,0.0,,,DD.48.YYYY 23:48:24,0.0,0.0,0.0,0.0,0.0,0.0,0.0,0.0,0.0,0.0,0.0,0.0,0.0,0.0,0.0,0.0,0.0,0.0,1.0,0.0,0.0,0.0,0.0,0.0,0.0,0.0,0.0,0.0,0.0
513,Taft Botanical Gardens - SimpliPhi Power,Electro-chemical,Lithium Iron Phosphate Battery,Lithium Iron Phosphate Battery,Operational,"SimpliPhi Power and California Solar Electric have completed the  second phase of an off-grid solar plus storage installation at the Taft Botanical Gardens in Ojai, Calif, which are part of an eco resort owned by the non-profit Conservation Endowment Fund.  Taft Gardens was challenged to preserve the pristine natural environment of the gardens while at the same time generating and harvesting enough off-grid power to accommodate expanding operations at this remote location. California Solar Electric originally designed and installed an off-grid hybrid solar power generation and storage solution that would eliminate trenching power lines and dramatically reduce generator use and fuel consumption for the eco resort.   Phase one of the off-grid solar plus storage system involved the installation of eight PHI2.6 kWh batteries (48 v) to provide over 20 kWh of stored power for the facilities&#039; main lodge and three separate living quarters. A year later, it was evident that the solar PV generation exceeded both the resort&#039;s daily electricity loads and the battery storage capacity. Increasing the battery storage allowed them to capture all their PV generation and store more power for evening loads in order to maximize their capital investment - all off grid.",10.0,,,,34.0,-119.0,,"Microgrid Capability, ",Ojai,California,United States,,22.03.2016,,,,,,,,California Solar Electric,0.0,,0.0,0.0,,,DD.55.YYYY 18:55:13,0.0,0.0,0.0,0.0,0.0,0.0,0.0,0.0,0.0,0.0,0.0,0.0,0.0,0.0,1.0,0.0,0.0,0.0,0.0,0.0,0.0,0.0,0.0,0.0,0.0,0.0,0.0,0.0,0.0
514,"BJ&#039;s Wholesale Club - SolarCity / Direct Energy - (Framingham, MA)",Electro-chemical,Electro-chemical,Lithium-ion Battery,Operational,"SolarCity and Texas-based Direct Energy installed solar electric and energy storage systems at two BJ&#039;s Wholesale Club locations in Massachusetts.  BJ&#039;s in Framingham hosts a 400 kW rooftop photovoltaic system, while the Dedham location has a 764 kW array. Both sites will have a 200 kW / 400kWh lithium-ion battery storage system.  SolarCity will also install a 1.3 MW solar system on BJ&#039;s distribution facility in Uxbridge, Mass., this year. All three of these new solar projects for BJ&#039;s were assisted by a dedicated investment fund created by Direct Energy and SolarCity in 2013 to finance up to $124 million in solar projects.  http://www.solarcity.com/newsroom/press/bj%E2%80%99s-wholesale-club-saves-energy-storage-direct-energy-and-solarcity",200.0,,,,42.0,-71.0,,"Electric Bill Management, Electric Bill Management with Renewables, Electric Energy Time Shift, Renewables Energy Time Shift, ",Framingham,Massachusetts,United States,16.10.2014,01.02.2015,,,ISO-NE,,,,400 kW rooftop photovoltaic system,,0.0,,0.0,0.0,,,DD.14.YYYY 00:14:07,0.0,0.0,0.0,0.0,1.0,1.0,1.0,0.0,0.0,0.0,0.0,0.0,0.0,0.0,0.0,0.0,0.0,0.0,0.0,1.0,0.0,0.0,0.0,0.0,0.0,0.0,0.0,0.0,0.0
515,HELCO BESS - Koyo (NELHA),Electro-chemical,Electro-chemical,Lithium-ion Battery,Operational,"The battery energy storage system located at Koyo USA Corp, a tenant of the Natural Energy Laboratory of Hawaii Authority (NELHA), is a Saft turnkey energy storage system (ESS) comprised of two Intensium Max 20E containers integrated with a 100 kW Power Conversion System to the Hawaii Electric Light Company (HELCO) to increase the grids&#039; ability to integrate more renewable energy.    The project aims to achieve the integration of ever‐increasing amounts of renewable energy. The Hawaii Big Island is already a leader, with more than one‐third of its energy coming from renewable sources.",100.0,,,,19.717396700000002,-156.05,,"Distribution upgrade due to solar, Frequency Regulation, Renewables Capacity Firming, ","Kailua Kona, Hawaii 96740",Hawaii,United States,01.09.2010,01.06.2012,,,,Hawaii Electric Light Company,Investor Owned,,,,15.0,,0.0,0.0,Natural Energy Laboratory of Hawaii Authority (NELHA),NELHA administers the world’s premier energy and ocean technology park.,,0.0,0.0,1.0,0.0,0.0,0.0,0.0,0.0,0.0,0.0,1.0,0.0,0.0,0.0,0.0,0.0,0.0,0.0,1.0,0.0,0.0,0.0,0.0,0.0,0.0,0.0,0.0,0.0,0.0
516,"SDG&amp;E / Hecate Energy Bancroft - (San Diego, CA)",Electro-chemical,Electro-chemical,Lithium-ion Battery,Contracted,"San Diego Gas &amp;amp; Electric (SDG&amp;amp;E) announced that it has signed a contract with Hecate Energy Bancroft, LLC for a  20 megawatt (MW) energy storage facility that will be capable of storing enough electricity to power 28,000 homes for up to four hours. The lithium ion battery project is the largest of its kind in the San Diego region. Building on SDG&amp;amp;E’s commitment to create efficiencies and provide clean energy, the storage facility will support the company’s leadership position in delivering more renewable energy and bringing other sustainable practices directly into the community. Along with SDG&amp;amp;E solutions for increasing the number of zero-emission vehicles, these efforts help to lower the region’s carbon footprint overall.  The 20 MW battery project will be owned by Hecate Energy Bancroft LLC and supply energy under a 20-year power purchase agreement to SDG&amp;amp;E. The facility is expected to be completed by 2019.",20000.0,,,,33.0,-117.0,,"Electric Energy Time Shift, Renewables Capacity Firming, Renewables Energy Time Shift, ",San Diego,California,United States,31.03.2016,01.01.2019,,,CAISO,San Diego Gas and Electric,Investor Owned,Transmission,,,20.0,,0.0,0.0,,,,0.0,0.0,0.0,0.0,0.0,0.0,1.0,0.0,0.0,0.0,0.0,0.0,0.0,0.0,0.0,0.0,0.0,0.0,1.0,1.0,0.0,0.0,0.0,0.0,0.0,0.0,0.0,0.0,0.0
519,Temecula Valley Unified School District - SolarCity,Electro-chemical,Lithium-ion Battery,Lithium-ion Battery,Operational,"SolarCity and Temecula Valley Unified School District (TVUSD) are together installing a six megawatt solar and energy storage project across 19 schools and the district&#039;s administrative office. The project includes 18 solar carports and two ground mount solar arrays. Five of the project&#039;s sites will also be equipped with DemandLogic, SolarCity&#039;s smart energy storage system. The energy storage systems will have 2,600 kilowatt hours of energy storage capacity that can later be intelligently dispatched during times of highest demand. TVUSD will reduce energy costs by using stored electricity to lower peak demand, further contributing to the district&#039;s overall cost savings.",260.0,,,,33.4936391,-117.15,,"Electric Bill Management with Renewables, Renewables Energy Time Shift, ",Temecula,California,United States,06.10.2015,,,,CAISO,Southern California Edison,Investor Owned,Secondary Distribution,6 MW of solar across 19 schools and the district&#039;s administrative office,SolarCity,25.0,"It is expected to save the district more than $520,000 within the first year of operation alone, and $35 million over 25 years by providing affordable power at a discount to utility rates.",20000000.0,0.0,,,DD.33.YYYY 01:33:48,0.0,0.0,0.0,0.0,0.0,1.0,0.0,0.0,0.0,0.0,0.0,0.0,0.0,0.0,0.0,0.0,0.0,0.0,0.0,1.0,0.0,0.0,0.0,0.0,0.0,0.0,0.0,0.0,0.0
520,New Orleans City Hall - PosiGen / SimpliPhi Power,Electro-chemical,Lithium-ion Battery,Lithium-ion Battery,Operational,"PosiGen Solar Solutions, made a clean energy contribution to the City of New Orleans to help create a resilient City Hall. PosiGen, with partners SimpliPhi Power and Schneider Electric, is providing 25 kW of solar PV panels, energy storage and an educational monitoring display for the public. The rooftop solar installation will deliver clean power for City Hall to reduce energy costs, as well as provide backup power in the event of power disruptions or a future natural disaster.",10.0,,,,30.0,-90.0,,"Electric Bill Management with Renewables, Resiliency, ",New Orleans,Louisiana,United States,,26.08.2015,,,,Entergy,Investor Owned,Secondary Distribution,25 kW rooftop PV,,0.0,,0.0,0.0,,,DD.52.YYYY 01:52:14,0.0,0.0,0.0,0.0,0.0,1.0,0.0,0.0,0.0,0.0,0.0,0.0,0.0,0.0,0.0,0.0,0.0,0.0,0.0,0.0,1.0,0.0,0.0,0.0,0.0,0.0,0.0,0.0,0.0
521,Izu Oshima Battery Storage System - Hitachi Chemical Company,Electro-chemical,Lithium-ion Battery,Lithium-ion Battery,Operational,"In cooperation with TEPCO Power Grid, Inc., Hitachi has been conducting a demonstration project on its large-scale battery energy storage system on Izu Oshima Island south of Tokyo.   The island has an independent power grid and is a suitable testing site to assess the effect of introducing large amounts of energy from renewable sources on the grid. In the demonstration project, which is aiming toward the commercialization of the system, the durability of the battery energy storage system was an especially important concern.   Hitachi Chemical Company, Ltd., the developer of the lead batteries, has more than 10 years&#039; experience in delivering devices to reduce power fluctuation. The company has been researching and analyzing batteries for longevity and has accumulated a knowledge base on the improvement of battery performance. In the Izu Oshima Island demonstration, Hitachi has also evaluating the durability and performance of the battery energy storage system through deterioration analysis utilizing data from Hitachi Chemical Company, Ltd. Further, Hitachi is creating control systems to monitor the operational status of the battery energy storage system for the demonstration project, not just for onsite monitoring but also for remote monitoring from the TEPCO&#039;s Oshima Power Plant at Izu Oshima Island in Tokyo and Hitachi&#039;s Omika Works in Ibaraki Prefecture. Hitachi is striving to develop control technology from research and analysis of the data for the operation of battery energy storage systems.  As Izu Oshima Island has been relying on diesel power generation, one of the purposes of this demonstration project is to evaluate the effect of using the battery energy storage system in reducing fuel costs. Hitachi is looking to find economical solutions to improve power grids in other island regions that have been relying on fossil fuels for their power supply. Hitachi is working towards optimal utilization of renewable energy and diesel power generation.",1500.0,,,,34.740883600000004,139.39,,"Electric Energy Time Shift, Electric Supply Capacity, Frequency Regulation, ", Izu Oshima, Izu Oshima,Japan,24.12.2014,05.05.2015,,,,Tokyo Electric Power Company (TEPCO),Investor Owned,Primary Distribution,,Hitachi Chemical Company,0.0,,0.0,0.0,,,DD.31.YYYY 20:31:30,0.0,0.0,0.0,0.0,0.0,0.0,1.0,1.0,0.0,0.0,1.0,0.0,0.0,0.0,0.0,0.0,0.0,0.0,0.0,0.0,0.0,0.0,0.0,0.0,0.0,0.0,0.0,0.0,0.0
524,West-Ansung (Seo-Anseong) Substation ESS Pilot Project - 28 MW ESS - KEPCO / Kokam / LG Chem,Electro-chemical,Lithium-ion Battery,Lithium-ion Battery,Operational,"KEPCO established a plan to build 500 MW of energy storage systems (ESS) for frequency regulation in stages over four years (2014-2017).    In 2014, for the first stage, KEPCO successfully installed 52 MW of ESS for frequency regulation across two sites, 28 MW at West-Ansung Substation and 24 MW at Shin-Yongin Substation.  KEPCO installed 28 MW (7 MWh) of Li-ion battery based energy storage for frequency regulation. Kokam provided Lithium-titanate (LTO) based Lithium Polymer battery energy storage for 16 MW / 5.4 MWh and LG Chem provided 12 MW. The ESS is currently in commercial operation as of June 2015 (Note: System testing took place before commercial operation from January 2015 to June 2015).  http://kokam.com/adv/news.php  http://home.kepco.co.kr/kepco/main.do",28000.0,,,,37.0969412,127.22,,"Frequency Regulation, Transmission Congestion Relief, Voltage Support, ","84 Jangseo-ri, Yangseong-myeon, Anseong-si",Gyeonggi-do,"Korea, South",,10.07.2015,01.09.2014,,,Korea Electric Power Corporation (KEPCO),Public Owned,,,Korea Electric Power Corporation (KEPCO),0.0,,0.0,0.0,,,DD.37.YYYY 21:37:50,0.0,0.0,0.0,0.0,0.0,0.0,0.0,0.0,0.0,0.0,1.0,0.0,0.0,0.0,0.0,0.0,0.0,0.0,0.0,0.0,0.0,0.0,1.0,0.0,0.0,0.0,0.0,0.0,1.0
525,Shin-Gimje Substation ESS - 24 MW ESS - KEPCO / Kokam,Electro-chemical,Electro-chemical,Lithium Nickel Manganese Cobalt Battery,Operational,"KEPCO installed 24 MW (9 MWh) of Li-ion battery based energy storage system for frequency regulation in 2015. At the time of commissioning, Shin-Gimje Substation was the largest capacity Lithium Nickel Manganese Cobalt energy storage used for frequency regulation in the world.",24000.0,,,,35.7590321,127.0,,"Frequency Regulation, Transmission Congestion Relief, Voltage Support, ",86 Yongbok-ri,"Geumgu-myeon, Gimje-si","Korea, South",02.07.2015,07.03.2016,31.08.2015,,,Korea Electric Power Corporation (KEPCO),Public Owned,,,,0.0,,0.0,0.0,,,DD.32.YYYY 21:32:03,0.0,0.0,0.0,0.0,0.0,0.0,0.0,0.0,0.0,0.0,1.0,0.0,0.0,0.0,0.0,0.0,0.0,0.0,0.0,0.0,0.0,0.0,1.0,0.0,0.0,0.0,0.0,0.0,1.0
528,College of Marin Kentfield Campus - Tesla,Electro-chemical,Electro-chemical,Lithium-ion Battery,Operational,"College of Marin is the first community college in California to partner with Tesla to install the new stationary storage products (Tesla Powerpack) on campus.  Being selected as a site for the energy storage systems comes with $5.3 million in government incentives that will cover site preparation costs and installation of the lithium-ion battery pack, liquid thermal control system, and software that receives dispatch commands from a solar inverter. Concrete slabs will be installed behind the Student Services Building at the Kentfield Campus and near the Main Building at the Indian Valley Campus.  Vice President Greg Nelson expects installation to begin in mid-May and last until the end of June. Once the stationary batteries are operational, Nelson estimates the cost savings to be anywhere from $100,000-$150,000 annually for the college.",2400.0,,,,37.955595,-122.55,,"Electric Bill Management, Electric Energy Time Shift, ",Kentfield,California,United States,01.01.2015,01.07.2016,15.05.2016,,CAISO,,,,,,0.0,"$100,000 - $150,000 annual savings",0.0,0.0,,,DD.18.YYYY 19:18:13,0.0,0.0,0.0,0.0,1.0,0.0,1.0,0.0,0.0,0.0,0.0,0.0,0.0,0.0,0.0,0.0,0.0,0.0,0.0,0.0,0.0,0.0,0.0,0.0,0.0,0.0,0.0,0.0,0.0
530,Entergy Solar-Plus-Storage Pilot Project,Electro-chemical,Lithium-ion Battery,Lithium-ion Battery,Announced,A pilot solar-plus-storage project to test the use of a 500 kWh lithium-ion battery to balance the variability of a 1 MW solar array.,1000.0,,,,29.9510658,-90.07,,"Renewables Capacity Firming, ",New Orleans,Louisiana,United States,24.08.2015,,02.02.2016,,,Entergy,Investor Owned,,,,0.0,,0.0,0.0,,,DD.25.YYYY 23:25:12,0.0,0.0,0.0,0.0,0.0,0.0,0.0,0.0,0.0,0.0,0.0,0.0,0.0,0.0,0.0,0.0,0.0,0.0,1.0,0.0,0.0,0.0,0.0,0.0,0.0,0.0,0.0,0.0,0.0
531,McHenry Battery Storage Project - EDF Renewable Energy,Electro-chemical,Electro-chemical,Lithium-ion Battery,Operational,"EDF Group’s first battery storage project in North America, developed and built by EDF Renewable Energy, reached commercial operation on December 20, 2015. The energy storage system, located in McHenry County, Illinois, added 40 megawatts (MW) of flexible capacity (20 MW nameplate) to the PJM Regional Transmission Organization (RTO) and will participate in both the regulation and capacity markets.   EDF Renewable Energy acquired 100% interest in the project late in the first quarter of 2015 from Chicago-based GlidePath Power; construction commenced in June 2015. The system is interconnected at the distribution level into Commonwealth Edison Company (ComED). The battery and power electronics were supplied by BYD America, consisting of 11 containerized units totaling 20 MW (22MVA) and is performing at expectation ***Note the 19.8 MW number comes from GlidePath&#039;s website www.glidepath.net",20000.0,,,,42.303999299999994,-88.4,,"Electric Supply Capacity, Frequency Regulation, ",McHenry County,Illinois,United States,,20.12.2015,,,PJM,ComEd,Investor Owned,Primary Distribution,,GlidePath Power &amp; EDF Renewable Energy,0.0,,0.0,0.0,,,DD.13.YYYY 19:13:31,0.0,0.0,0.0,0.0,0.0,0.0,0.0,1.0,0.0,0.0,1.0,0.0,0.0,0.0,0.0,0.0,0.0,0.0,0.0,0.0,0.0,0.0,0.0,0.0,0.0,0.0,0.0,0.0,0.0
534,DeGrussa Copper Mine - juwi AG,Electro-chemical,Lithium-ion Battery,Lithium-ion Battery,Operational,"juwi’s Australian unit built the 10.6 megawatt solar park at the DeGrussa mine about 560 miles (901 kilometers) north of Perth for Sandfire Resources NL. The park’s 34,000 solar modules are spread over 49 acres and linked to a 6 megawatt battery storage system. Together they’ll supply daytime power for Degrussa.  A 19 megawatt diesel plant can take over the mine’s power supply when the solar panels aren’t producing. The solar plant will reduce DeGrussa’s carbon dioxide emissions by 12,000 tons annually and cut diesel consumption by 1.3 million gallons or 20 percent. The project was financed by the Clean Energy Corporation, Neoen SAS and with a $15.7 million USD grant from the Australian Renewable Energy Agency.  Sandfire Resources NL signed the offtake of electricity for 6 years and Origin energy signed the offtake for LGC’s (Green Certificates) for 5.5 years. The CEFC (Clean Energy Finance Corporation) provided the project debt.  http://www.energy-storage.news/editors-blog/in-pictures-australian-copper-and-gold-mines-solar-diesel-storage-hybrid-pr  https://www.youtube.com/watch?v=ubThWq_WTLM&amp;amp;feature=youtu.be",6000.0,,,,-26.362271500000002,118.61,,"Electric Bill Management, Electric Bill Management with Renewables, Electric Energy Time Shift, Electric Supply Reserve Capacity - Spinning, Frequency Regulation, Microgrid Capability, On-Site Power, Onsite Renewable Generation Shifting, Ramping, Renewables Capacity Firming, Renewables Energy Time Shift, Resiliency, ",Meekatharra,Western Australia,Australia,,08.06.2016,01.07.2015,,,,,,10.6 MW Solar PV and a 19 MW Diesel Plant,juwi Renewable Energy,0.0,"Save 30% on Fuel Costs, Diesel Consumption to be Cut by 20%",30000000.0,0.0,,,DD.02.YYYY 22:02:21,0.0,0.0,0.0,0.0,1.0,1.0,1.0,0.0,0.0,1.0,1.0,0.0,0.0,0.0,1.0,1.0,1.0,1.0,1.0,1.0,0.0,0.0,0.0,0.0,0.0,0.0,0.0,0.0,0.0
535,Iksan ESS - LG Chem,Electro-chemical,Lithium-ion Battery,Lithium Iron Phosphate Battery,Operational,"LG Group is working on accelerating the success of its energy solution products by installing them in its factories.   The conglomerate aims to insert solar energy panels on the roofs of 19 of its factories and also plans to equip LG Chem plants in Iksan, North Jeolla, and Ochang, North Chungcheong, with efficient energy storage systems (ESS).  LG believes that establishing and operating these products in its own plants will help it to manage energy efficiency while gaining the trust of potential clients.",3000.0,,,,35.948285799999994,126.96,,"Electric Bill Management with Renewables, Resiliency, ",Iksan,North Jeolla,"Korea, South",,02.07.2014,01.07.2014,,,,,,,LG Chem,0.0,The new facilities with ESS are expected to save about 1.3 billion won ($1.2 million) annually for the company and will also help LG deal with power shortages without having to shut down its plants.,0.0,0.0,,,DD.52.YYYY 17:52:42,0.0,0.0,0.0,0.0,0.0,1.0,0.0,0.0,0.0,0.0,0.0,0.0,0.0,0.0,0.0,0.0,0.0,0.0,0.0,0.0,1.0,0.0,0.0,0.0,0.0,0.0,0.0,0.0,0.0
536,Ochang ESS - LG Chem,Electro-chemical,Lithium-ion Battery,Lithium Iron Phosphate Battery,Operational,"LG Group is working on accelerating the success of its energy solution products by installing them in its factories.   The conglomerate aims to insert solar energy panels on the roofs of 19 of its factories and also plans to equip LG Chem plants in Iksan, North Jeolla, and Ochang, North Chungcheong, with efficient energy storage systems (ESS).  LG believes that establishing and operating these products in its own plants will help it to manage energy efficiency while gaining the trust of potential clients.  http://koreajoongangdaily.joins.com/news/article/Article.aspx?aid=2987055",1500.0,,,,0.0,0.0,,"Electric Bill Management with Renewables, Resiliency, ",Ochang,North Jeolla,"Korea, South",,,01.07.2014,,,,,,,LG Chem,0.0,LG Chem expects energy related cost to be cut up to 4 hundred million KRW with the newly constructed large capacity ESS.,0.0,0.0,,,DD.58.YYYY 17:58:43,0.0,0.0,0.0,0.0,0.0,1.0,0.0,0.0,0.0,0.0,0.0,0.0,0.0,0.0,0.0,0.0,0.0,0.0,0.0,0.0,1.0,0.0,0.0,0.0,0.0,0.0,0.0,0.0,0.0
537,Schneider Electric-Boston One,Electro-chemical,Lithium-ion Battery,Lithium-ion Battery,Announced,Schneider Electric announced that it is building a 400-kW solar plus storage microgrid at its Boston One campus in Massachusetts. The system will be able to store up to 1-MWh of electricity and will be able to “island” so as to potentially provide emergency shelter in the event of a long duration outage.,400.0,,,,42.6583356,-71.14,,"Electric Energy Time Shift, Microgrid Capability, Resiliency, ",Andover,Massachusetts,United States,10.02.2016,,,,ISO-NE,,,,,Duke Energy,20.0,"The System could supply up to 560,000 kWh of electricity per year.",0.0,0.0,,,DD.59.YYYY 23:59:25,0.0,0.0,0.0,0.0,0.0,0.0,1.0,0.0,0.0,0.0,0.0,0.0,0.0,0.0,1.0,0.0,0.0,0.0,0.0,0.0,1.0,0.0,0.0,0.0,0.0,0.0,0.0,0.0,0.0
538,Vlissingen Advancion Energy Storage - AES,Electro-chemical,Lithium-ion Battery,Lithium-ion Battery,Operational,"The Netherlands Advancion Energy Storage Array has begun operating and provides 10 MW / 10 MWh of storage to Dutch transmission system operator TenneT. The project, which is AES’s first installation on the European continent, will provide Primary Control Reserve (PCR), matching supply and demand on the local grid by using power stored in its batteries to respond quickly to grid imbalances. PCR is known by a number of other terms, such as frequency regulation, in the US and elsewhere.",10000.0,,,,51.453667200000005,3.57,,"Frequency Regulation, ",Vlissingen,Zeeland,Netherlands,,31.12.2015,13.07.2015,,TenneT,,,,,AES,0.0,,0.0,0.0,,,DD.44.YYYY 20:44:42,0.0,0.0,0.0,0.0,0.0,0.0,0.0,0.0,0.0,0.0,1.0,0.0,0.0,0.0,0.0,0.0,0.0,0.0,0.0,0.0,0.0,0.0,0.0,0.0,0.0,0.0,0.0,0.0,0.0
540,Charlotte Hobbs Memorial Library - JuiceBox Energy,Electro-chemical,Electro-chemical,Lithium-ion Battery,Operational,"JuiceBox Energy and ReVision Energy have embarked upon a unique installation of an 8.1 KW solar panel array and an innovative energy storage system at the Charlotte Hobbs Memorial Library in Lovell, Maine. The 115-year-old library is being outfitted with the latest in high-tech energy storage that supports the board of trustees’ mission statement to combine the traditional role of the institution with a commitment to reducing the building’s carbon footprint. Funded by an anonymous donor, this project provides the library with integrated solar and energy storage to reduce grid reliance, lower costs, and ensure emergency standby electricity. The combined system consists of 27 high-efficiency solar panels and the intelligent JuiceBox Energy Storage solution  that can be controlled over a cellular, cloud-based network.",6.0,,,,44.0,-71.0,,"Electric Bill Management with Renewables, Grid-Connected Commercial (Reliability &amp; Quality), Renewables Energy Time Shift, Resiliency, ",Lovell,Maine,United States,26.02.2016,,,,ISO-NE,Central Maine Power (subsidiary of Iberdrola),Investor Owned,Secondary Distribution,8.1 kW Solar Array,,0.0,,0.0,0.0,,,DD.24.YYYY 01:24:24,0.0,0.0,0.0,0.0,0.0,1.0,0.0,0.0,0.0,0.0,0.0,1.0,0.0,0.0,0.0,0.0,0.0,0.0,0.0,1.0,1.0,0.0,0.0,0.0,0.0,0.0,0.0,0.0,0.0
