816,Kyushu Electric Power/GS Yuasa Ashibe Substation ESS Demo,Electro-chemical,Lithium-ion Battery,Lithium-ion Battery,Operational,"GS Yuasa installed a lithium-ion battery system at testing facilities in Iki City, Nagasaki Prefecture in order to study the optimal methods to use storage batteries to control power system frequency fluctuation on remote islands. The system was constructed by Mitsubishi Electric Corporation Kyushu Electric Power Co., Inc., and has been operating successfully at the power company’s Ashibe substation in Iki City since March 2013. The tests are scheduled to continue through fiscal 2014. The lithium-ion battery system is being used to charge and discharge power during periods when power generation from wind, solar and other renewable power sources changes suddenly, thereby stabilizing the amount of power delivered to the power grid and controlling the system’s frequency fluctuation.  The lithium-ion battery system installed at the testing facilities comprises eight storage battery units, housing 96 LIM50E modules. The entire system is housed within two storage battery enclosures measuring 10 meters wide by 7 meters deep.  System Overview:   Module type:  LIM50E-12G2-C2 (12-cell modules) Number of batteries:  9,216 cells (8 units, each comprising 16 modules connected  in series and 6 modules in parallel) Capacity (kWh): 1,616 (202 x 8 units) Nominal voltage (V):  710.4 Dimensions (mm):  W4800 x D850 x H2050 (per unit) Mass (kg):  Approx. 4,600 (per unit) Cooling system:  Self-cooling",1279.0,,,,33.801206,129.76,,"Frequency Regulation, Renewables Capacity Firming, ","Ashibe, Iki",Nagasaki,Japan,04.11.2013,,,,,Kyushu Electric Power Company,Investor Owned,Secondary Distribution,,,0.0,,0.0,0.0,,,DD.17.YYYY 16:17:24,0.0,0.0,0.0,0.0,0.0,0.0,0.0,0.0,0.0,0.0,1.0,0.0,0.0,0.0,0.0,0.0,0.0,0.0,1.0,0.0,0.0,0.0,0.0,0.0,0.0,0.0,0.0,0.0,0.0
821,Enel Chiaravalle Substation,Electro-chemical,Lithium-ion Battery,Lithium-ion Battery,Operational,"The substation is located in Chiaravalle, an area with a high level of variable and intermittent power from renewable energy sources that can cause reverse power flows on the high/medium voltage transformers. The Energy Storage System will be used to control the energy flow between Enel&#039;s network and the national grid.",2000.0,,,,38.679328999999996,16.41,,"Ramping, Stationary Transmission/Distribution Upgrade Deferral, ",Chiaravalle,Calabria,Italy,04.10.2012,25.02.2014,,,,Enel,Investor Owned,Primary Distribution,Chiaravalle Substation,"NEC Energy Solutions, Inc.",0.0,,0.0,0.0,,,DD.38.YYYY 22:38:48,0.0,0.0,0.0,0.0,0.0,0.0,0.0,0.0,0.0,0.0,0.0,0.0,0.0,0.0,0.0,0.0,0.0,1.0,0.0,0.0,0.0,1.0,0.0,0.0,0.0,0.0,0.0,0.0,0.0
822,Ray Power Systems Beijing Frequency Regulation Project,Electro-chemical,Lithium-ion Battery,Lithium-ion Battery,Operational,"A123 Energy Solutions announced that a new 2-megawatt Grid Storage Solution™ for Ray Power Systems Co. Ltd., a Beijing-based energy services company, is now in commercial operation providing frequency regulation services. Located in Beijing, this is A123 Energy Solutions’ first deployment in China in commercial operation. The containerized 53-foot long battery is one of A123’s widely deployed High Rate (HR) Grid Storage Solutions and stabilizes the grid to ensure power quality.    The 2MW HR Grid Storage Solution, a high power battery based on A123’s proprietary Nanophosphate® chemistry, is able to serve dual duty – as both a controllable 2MW load as well as a 2MW generator – in essence providing 4MW of ramping capability. Deployed worldwide in revenue service since 2009, the HR Grid Storage Solution forms the bulk of the grid energy storage product line that A123 Energy Solutions has delivered to date.",2000.0,,,,39.904336,116.41,,"Frequency Regulation, ",Beijing,Beijing,China,20.07.2012,01.01.2014,01.12.2014,,,,,,,,0.0,,0.0,0.0,,,DD.10.YYYY 18:10:51,0.0,0.0,0.0,0.0,0.0,0.0,0.0,0.0,0.0,0.0,1.0,0.0,0.0,0.0,0.0,0.0,0.0,0.0,0.0,0.0,0.0,0.0,0.0,0.0,0.0,0.0,0.0,0.0,0.0
823,IHI Corporation Tohoku Long Duration A123 System,Electro-chemical,Lithium-ion Battery,Lithium-ion Battery,Operational,"A123 Energy Solutions announced today that it will supply, install, and commission a 1MW, 2.8MWh GSS™ to IHI Corporation. IHI Corporation is one of the largest industrial equipment manufacturers in Japan and makes products for a diverse set of markets including aerospace, energy, social infrastructure, and heavy machinery. The GSS is currently in the process of being installed at an IHI factory located in the Tohoku region of Japan. Once operational, the GSS will be used to integrate a large PV solar generation array co-located at the facility and help reduce the factory’s overall load, which will in turn help ease the strain on Japan’s grid which has been in rebuilding mode since the 2011 Eastern Japan earthquake.   The Grid Storage Solution™, or GSS, will utilize the company’s Long Duration Grid Battery System (GBS-LD), a standard but flexible grid energy storage unit accommodating configurations that range from as little as 100kW to 4MW. The GBS-LD can be packaged in standardized 20-foot, 40-foot, and 53-foot long containers, custom enclosures, or in pre-existing buildings. Utilizing A123 Systems Nanophosphate® prismatic cell technology, up to 100MW and 100MWh of energy storage can be deployed onto a single acre of land.",1000.0,,,,31.7623756,131.09,,"Electric Bill Management with Renewables, Onsite Renewable Generation Shifting, ",Tohoku,Tohoku,Japan,29.01.2014,,01.01.2014,,,,,,PV Array,,0.0,,0.0,0.0,,,DD.19.YYYY 20:19:25,0.0,0.0,0.0,0.0,0.0,1.0,0.0,0.0,0.0,0.0,0.0,0.0,0.0,0.0,0.0,0.0,1.0,0.0,0.0,0.0,0.0,0.0,0.0,0.0,0.0,0.0,0.0,0.0,0.0
825,Regina High Wind and Storage Project - Cowessess First Nation,Electro-chemical,Lithium-ion Battery,Lithium-ion Battery,Operational,"Saft has been selected by Cowessess First Nation(CFN) to design, produce and install 2 Intensium® Max 20E lithium-ion battery systems as part of the High Wind and Storage Project near the City of Regina, Saskatchewan.  The grid‐connected ESS system will help optimize renewable wind power performance by increasing reliability and decreasing volatility by as much as 70 percent over the 15‐year lifespan of the system. The Li‐ion ESS includes a state‐of‐the-art, 400kW Power Conditioning System for use in conjunction with an 800kW utility scale wind turbine.  Check out the project video here: https://www.youtube.com/watch?v=UE7varh2VZY  http://tinyurl.com/p5tc4pe",400.0,,,,50.416990000000006,-104.46,,"Electric Supply Capacity, Grid-Connected Commercial (Reliability &amp; Quality), Renewables Capacity Firming, Renewables Energy Time Shift, ",Regina,Saskatchewan,Canada,07.11.2012,19.04.2013,01.10.2012,,MISO,SaskPower,Public Owned,Secondary Distribution,800 kW Wind Turbine,Cowessess First Nation,15.0,Battery AC-to-AC RTE: 81.5%; Availability to date: 85%; Reduces wind volatility by 78%,5164319.0,0.0,Saskatchewan Research Council,,DD.11.YYYY 16:11:01,0.0,0.0,0.0,0.0,0.0,0.0,0.0,1.0,0.0,0.0,0.0,1.0,0.0,0.0,0.0,0.0,0.0,0.0,1.0,1.0,0.0,0.0,0.0,0.0,0.0,0.0,0.0,0.0,0.0
826,HELCO BESS - West Hawaii Civic Center,Electro-chemical,Lithium-ion Battery,Lithium-ion Battery,Operational,"The battery energy storage system located at the West Hawaii Civic Center is a Saft turnkey energy storage system (ESS) comprised of two Intensium Max 20E containers integrated with a 100 kW Power Conversion System to the Hawaii Electric Light Company (HELCO) to increase the grids&#039; ability to integrate more renewable energy.  The project aims to achieve the integration of ever‐increasing amounts of renewable energy. The Hawaii Big Island is already a leader, with more than one‐third of its energy coming from renewable sources.",100.0,,,,20.0,-156.0,,"Distribution upgrade due to solar, Frequency Regulation, Renewables Capacity Firming, ",Kailua-Kona,Hawaii,United States,01.09.2010,01.06.2012,,,,Hawaii Electric Light Company,Investor Owned,,,,15.0,,0.0,0.0,Natural Energy Laboratory of Hawaii Authority (NELHA),NELHA administers the world’s premier energy and ocean technology park.,DD.36.YYYY 21:36:31,0.0,0.0,1.0,0.0,0.0,0.0,0.0,0.0,0.0,0.0,1.0,0.0,0.0,0.0,0.0,0.0,0.0,0.0,1.0,0.0,0.0,0.0,0.0,0.0,0.0,0.0,0.0,0.0,0.0
827,ADEME Intelligent Electricity Networks - Industrial Area Demonstration,Electro-chemical,Lithium-ion Battery,Lithium-ion Battery,Operational,"Saft will deploy 3 Intensium Max 20M containers as an integral part of an industrial area in the region of Toulouse, France.  The project benefits from funds within the framework of the future investment program &quot;Intelligent electricity networks&quot; managed by the French energy and environment agency (ADEME) and is coordinated by a company specialized in the design and implementation of electricity and IT systems that belongs to a French group.",3300.0,,,,43.60402020000001,1.48,,"Frequency Regulation, Renewables Capacity Firming, ",Toulouse,Haute-Garonne,France,01.07.2012,01.01.2013,,,,,,,,,0.0,,0.0,0.0,,,,0.0,0.0,0.0,0.0,0.0,0.0,0.0,0.0,0.0,0.0,1.0,0.0,0.0,0.0,0.0,0.0,0.0,0.0,1.0,0.0,0.0,0.0,0.0,0.0,0.0,0.0,0.0,0.0,0.0
829,JLM Energy: Alabama Solar-tied,Electro-chemical,Lithium-ion Battery,Lithium Iron Phosphate Battery,Operational,Princeton Power Systems was chosen for the energy conversion system feature set and capabilities. GTIB-100 (6x) - 3 on the battery and 3 on the PV were used.,300.0,,,,33.5080818,-86.79,,"Renewables Capacity Firming, ",Various,Alabama,United States,01.01.2014,,01.10.2013,,,,,,PV,,0.0,,0.0,0.0,,,DD.22.YYYY 22:22:50,0.0,0.0,0.0,0.0,0.0,0.0,0.0,0.0,0.0,0.0,0.0,0.0,0.0,0.0,0.0,0.0,0.0,0.0,1.0,0.0,0.0,0.0,0.0,0.0,0.0,0.0,0.0,0.0,0.0
831,EPSRC Grid Connected Energy Storage Research Demonstrator with WPD and Toshiba,Electro-chemical,Lithium-ion Battery,Lithium Ion Titanate Battery,Operational,"This Engineering and Physical Sciences Research Council (EPSRC) funded project will investigate the efficacy of energy storage to act upon an electrical network and supply power and energy back into the grid at appropriate times. The effort is part of the Grid Connected Energy Storage Research Demonstrator project, led by the University of Sheffield.  In September 2014 a main 2 MW (1 MWh) Lithium-Titanate SCiB system was supplied by Toshiba and ABB, with a further 250 kW system investigating the use of repurposed second life EV batteries.  Western Power Distribution (WPD) is providing the point of network connection and a short term lease at their 11 kV Willenhall substation, but UK regulations prohibit distribution network operators from generating electricity or trading in energy markets. So while the project will be owned and operated by EPSRC, both partners will closely monitor the &quot;effects on the network of this influx of energy storage, paying particular attention to the power requirement, diversity of connection and power quality experienced, to draw together a standard arrangement and assessment method for connecting more units in the future.&quot;  https://www.sheffield.ac.uk/creesa  http://www.epsrc.ac.uk/  http://www.businesswire.com/news/home/20140624005760/en/Toshiba-Supply-Lithium-Titanate-Battery-2MW-Energy-Storage#.U6l2S_ldWQA  http://www.edie.net/news/6/Universities-unite-to-connect-UK-s-fastest-energy-storage-system-to-the-grid/",2000.0,,,,52.5853723,-2.06,,"Frequency Regulation, Grid-Connected Commercial (Reliability &amp; Quality), ",Wolverhampton,West Midlands,United Kingdom,24.06.2014,17.03.2016,01.09.2014,,,Western Power Distribution,Investor Owned,Secondary Distribution,11 kV Substation,Engineering and Physical Sciences Research Council (EPSRC),0.0,,0.0,0.0,University of Sheffield,"This role in grid management will be investigated in the UK, in the Grid Connected Energy Storage Research Demonstrator project, led by the University of Sheffield, funded by the Engineering and Physical Sciences Research Council (EPSRC), with support from both industrial and academic partners.",DD.27.YYYY 23:27:48,0.0,0.0,0.0,0.0,0.0,0.0,0.0,0.0,0.0,0.0,1.0,1.0,0.0,0.0,0.0,0.0,0.0,0.0,0.0,0.0,0.0,0.0,0.0,0.0,0.0,0.0,0.0,0.0,0.0
832,EDF R&amp;D Les Renardières Concept Grid ESS,Electro-chemical,Lithium-ion Battery,Lithium-ion Battery,Operational,"The Alstom-Saft consortium has signed a frame contract with the EDF group to supply an initial energy storage system using a container of Lithium-ion batteries, demonstrating the system’s ability to regulate the frequency of the grid. Alstom&#039;s MaxSineTM eStorage solution, connected to Saft&#039;s Intensium® Max 20M storage system, will be installed on EDF R&amp;amp;D&#039;s experimental &quot;Concept Grid&quot;, dedicated to the development of grids and smart electrical systems. Located on the EDF site of Les Renardières south of Paris (Seine-et-Marne region), this is the first installation of its kind in France. The storage system and the power converter will be delivered in late 2014.  As part of this contract, Alstom and Saft will provide the complete 1 MW/30 min energy storage and conversion system. Saft will supply its Intensium® Max 20 foot lithium-ion battery container, while Alstom will install its MaxSineTM eStorage solution. Alstom&#039;s MaxSineTM eStorage includes a power converter that connects the Direct Current (DC) battery to the Alternating Current (AC) grid, and converts the electricity between DC and AC to be stored or released into the grid. It also includes real-time energy storage management software to optimize the production of electricity according to the needs of the grid.",1000.0,,,,48.371189,2.84,,"Frequency Regulation, ",Les Renardières,Seine-et-Marne,France,11.06.2014,24.06.2015,,,,Electricité de France (EDF),Federally Owned,Secondary Distribution,,,0.0,,0.0,0.0,,,DD.56.YYYY 00:56:34,0.0,0.0,0.0,0.0,0.0,0.0,0.0,0.0,0.0,0.0,1.0,0.0,0.0,0.0,0.0,0.0,0.0,0.0,0.0,0.0,0.0,0.0,0.0,0.0,0.0,0.0,0.0,0.0,0.0
833,Gasado Island Renewable &amp; Off-grid Integration,Electro-chemical,Lithium-ion Battery,Lithium Polymer Battery,Operational,"Hyosung announced the company would supply 1.25MW/3MWh ESS linked with new renewable energy generation systems such as wind power and sunlight in Gasado, located in Jindo-gun, Jeollanam-do.  This is part of the independent micro-grid project being run by the Korea Electric Power Research Institute. It has the biggest capacity among all the ESS established in the island regions of Korea. Hyosung plans to complete the work by late August, which will enable a more stable power supply to be delivered to the more than 380 residents of the 160 households of Gasado",1250.0,,,,34.4815801,126.05,,"Distribution upgrade due to wind, Microgrid Capability, Renewables Capacity Firming, Renewables Energy Time Shift, ",Jindo-gun,Jeollanam-do,"Korea, South",27.03.2014,,,,,,,,,,0.0,,0.0,0.0,,,DD.22.YYYY 19:22:22,0.0,0.0,0.0,1.0,0.0,0.0,0.0,0.0,0.0,0.0,0.0,0.0,0.0,0.0,1.0,0.0,0.0,0.0,1.0,1.0,0.0,0.0,0.0,0.0,0.0,0.0,0.0,0.0,0.0
834,Community Energy Storage for Grid Support (Residential CES Units) - DTE Energy,Electro-chemical,Lithium-ion Battery,Lithium-ion Battery,Operational,"This project is designed to demonstrate a proof of concept for aggregated Community Energy Storage Devices in a utility territory. The project is comprised of the following major research objectives: 1) Installation of 20 Community Energy Storage (CES) devices across a utility territory; 2) The installation and use of centralized communication across the service territory; 3) The integration of a renewable resource with energy storage; 4) The creation of algorithms for dispatching CES devices for peak shaving and demand response; 5) The integration and testing of secondary-use electric vehicle batteries; and 6) The use of Energy storage devices to provide ancillary services to the power grid.   The CES systems will use a number of battery energy storage units utilizing lithium batteries with the required electronics and energy conditioning devices to locate backup power near to the customer. The energy storage system consist of 20 separate 25 kw (50 kWh) CES units and a 500 kW lithium battery storage device integrated with a PV solar module.  At just under 1MW the CES units, coupled with the utility-scale PV and storage devices , will demonstrate peak shaving, demand response, voltage support, and emergency load relief; integration of renewable generation; and islanding during outages.",500.0,,,,41.910738,-83.43,,"Electric Bill Management with Renewables, Grid-Connected Residential (Reliability), On-Site Power, Renewables Capacity Firming, ",Monroe,Michigan,United States,,15.07.2013,,,MISO,Detroit Edison Energy,Investor Owned,Secondary Distribution,,DTE Energy,0.0,,0.0,0.0,,,DD.30.YYYY 20:30:55,0.0,0.0,0.0,0.0,0.0,1.0,0.0,0.0,0.0,0.0,0.0,0.0,1.0,0.0,0.0,1.0,0.0,0.0,1.0,0.0,0.0,0.0,0.0,0.0,0.0,0.0,0.0,0.0,0.0
837,SDG&amp;E Julian - S&amp;C / Kokam,Electro-chemical,Lithium-ion Battery,Lithium-ion Battery,Operational,Kokam and S&amp;amp;C Electric are supplying a 2.3 MWh lithium ion system for San Diego Gas and Electric&#039;s (SDG&amp;amp;E) Julian Substation.  The system will be used for islanding and capacity/infrastructure deferral.,1000.0,,,,33.0786552,-116.6,,"Microgrid Capability, Stationary Transmission/Distribution Upgrade Deferral, ",Julian,California,United States,28.02.2014,01.06.2014,01.04.2014,,CAISO,SDG&amp;E,Investor Owned,Primary Distribution,,,15.0,,0.0,0.0,,,DD.49.YYYY 19:49:15,0.0,0.0,0.0,0.0,0.0,0.0,0.0,0.0,0.0,0.0,0.0,0.0,0.0,0.0,1.0,0.0,0.0,0.0,0.0,0.0,0.0,1.0,0.0,0.0,0.0,0.0,0.0,0.0,0.0
839,RES Battery Utility of Ohio,Electro-chemical,Lithium-ion Battery,Lithium Iron Phosphate Battery,Operational,"The system is comprised of a +/-4 MW (8 MW total range) / 2.6MWh lithium battery that provides frequency regulation to the PJM system. The project utilizes lithium iron phosphate, an inherently safe variant of lithium battery chemistry. There are two containers that house batteries weighing approximately 20 tons each, as well as a third container that converts the direct current (DC) output to alternating current (AC) for injection and withdrawal of real power to and from the grid.",4000.0,,,,40.261109000000005,-82.83,,"Frequency Regulation, ",Sunbury,Ohio,United States,31.03.2014,20.06.2014,,,PJM,American Electric Power,Investor Owned,Primary Distribution,,RES America Developments Inc.,0.0,,0.0,0.0,,,DD.03.YYYY 02:03:23,0.0,0.0,0.0,0.0,0.0,0.0,0.0,0.0,0.0,0.0,1.0,0.0,0.0,0.0,0.0,0.0,0.0,0.0,0.0,0.0,0.0,0.0,0.0,0.0,0.0,0.0,0.0,0.0,0.0
840,SEPTA Wayside Energy Storage System - Viridity Energy,Electro-chemical,Lithium-ion Battery,Lithium-ion Battery,Operational,"The Energy Optimization project is designed to capture energy from rail cars through a regenerative braking process and then utilize the energy for accelerating trains, and to generate revenue through demand-side participation in power markets.  Saft will provide one Intensium Max 20P Li-ion megawatt energy storage system to capture train braking energy and then discharge it back to the third rail (power rail) to power trains leaving the station. The system will provide regenerative braking charge acceptance for SEPTA trains and power discharge back to the station to support rail traffic while simultaneously participating in the PJM Interconnection market for frequency regulation.  ABB is integrating the system with their power electronics.",900.0,,,,40.0,-75.0,,"Frequency Regulation, Onsite Renewable Generation Shifting, Transportation Services, Voltage Support, ",Philadelphia,Pennsylvania,United States,,15.08.2014,30.11.2013,,PJM,PECO,Public Owned,,,Viridity Energy,20.0,,1800000.0,0.0,,,DD.01.YYYY 19:01:39,0.0,0.0,0.0,0.0,0.0,0.0,0.0,0.0,0.0,0.0,1.0,0.0,0.0,0.0,0.0,0.0,1.0,0.0,0.0,0.0,0.0,0.0,0.0,0.0,0.0,0.0,0.0,1.0,1.0
844,AES Kilroot Advancion Energy Storage Array,Electro-chemical,Lithium-ion Battery,Lithium-ion Battery,Operational,"AES operates a 10 MW / 5 MWh energy storage system at its Kilroot power station in Northern Ireland. The Advancion Array is the largest battery energy storage facility in the UK and Ireland, and is installed inside Kilroot coal-fired generation plant.  It enhances grid reliability by providing fast response ancillary services, such as frequency response, for the All Island Electricity System, which has a high penetration of intermittent onshore wind energy. The system is connected to the System Operator of Northern Ireland (SONI).  The array uses more than 53,000 batteries, arranged in 136 separate nodes, and is the first step towards a planned 100 MW energy storage array adjacent to Kilroot.",10000.0,,,,54.725289000000004,-5.77,,"Frequency Regulation, ",Carrickfergus,Northern Ireland,United Kingdom,02.04.2014,24.12.2015,22.07.2015,,SONI,AES Kilroot Power Limited,Investor Owned,Primary Distribution,Coal-Fired Generation Plant,AES Energy Storage,0.0,,0.0,0.0,,,DD.19.YYYY 00:19:38,0.0,0.0,0.0,0.0,0.0,0.0,0.0,0.0,0.0,0.0,1.0,0.0,0.0,0.0,0.0,0.0,0.0,0.0,0.0,0.0,0.0,0.0,0.0,0.0,0.0,0.0,0.0,0.0,0.0
845,SEPTA Recycled Energy and Optimization Project - Viridity Energy,Electro-chemical,Lithium-ion Battery,Lithium-ion Battery,Operational,"The Energy Optimization project is designed to capture energy from rail cars through a regenerative braking process and then utilize the energy for accelerating trains, and to generate revenue through demand-side participation in power markets.  Saft will provide one Intensium Max 20P Li-ion megawatt energy storage system to capture train braking energy and then discharge it back to the third rail (power rail) to power trains leaving the station. The system will provide regenerative braking charge acceptance for SEPTA trains and power discharge back to the station to support rail traffic while simultaneously participating in the PJM Interconnection market for frequency regulation.",800.0,,,,39.9866038,-75.13,,"Frequency Regulation, Onsite Renewable Generation Shifting, Voltage Support, ",Philadelphia,Pennsylvania,United States,,15.04.2012,01.01.2012,,PJM,PECO,Public Owned,Primary Distribution,,Viridity Energy,15.0,"6/16/14 - Results achieved to date show that the single substation system on the Market-Frankford Line in North Philadelphia generates over $250,000 of annual energy savings and earned revenues. The initiative supports SEPTA’s Sustainability Program goal of reducing energy intensity (energy use per passenger mile) by 10 percent by 2015.",1900000.0,0.0,,,DD.08.YYYY 23:08:36,0.0,0.0,0.0,0.0,0.0,0.0,0.0,0.0,0.0,0.0,1.0,0.0,0.0,0.0,0.0,0.0,1.0,0.0,0.0,0.0,0.0,0.0,0.0,0.0,0.0,0.0,0.0,0.0,1.0
847,SmartRegion Pellworm (Lithium-Ion),Electro-chemical,Lithium-ion Battery,Lithium-ion Battery,Operational,"The project consists of the installation and operation of different complementary decentral storage technologies with a focus on innovative batteries. There is an integration of flexible loads on household level, central optimization of storage system by means of an energy management system, and analysis and real implementation of future business models with installed storage system.   There is a key focus on higher utilization of renewables within the region and more efficient integration into a congested distribution grid. Thus, the project plays an important role for customer interaction, technology acceptance and community collaboration. Lastly, the project led to the development of a storage blueprint in a future decentralized energy system.  http://forschung-energiespeicher.info/en/batteries-in-the-grid/projektliste/project-details/104/Hybrides_Speichersystem_basiert_auf_Erneuerbaren/",560.0,,,,54.523474,8.67,,"Electric Energy Time Shift, Electric Supply Capacity, Onsite Renewable Generation Shifting, Renewables Capacity Firming, Renewables Energy Time Shift, ",Island Pellworm,North Sea,Germany,,09.09.2013,,,,E.ON,Investor Owned,Secondary Distribution,Schleswig-Holstein Netz AG,,0.0,,0.0,0.0,,,DD.50.YYYY 23:50:25,0.0,0.0,0.0,0.0,0.0,0.0,1.0,1.0,0.0,0.0,0.0,0.0,0.0,0.0,0.0,0.0,1.0,0.0,1.0,1.0,0.0,0.0,0.0,0.0,0.0,0.0,0.0,0.0,0.0
