1194,Green Charge Networks GreenStation Announced 14,Electro-chemical,Lithium-ion Battery,Lithium-ion Battery,Announced,"Green Charge Networks installed an intelligent energy storage system.  Under the financed model, Green Charge Networks shares in the demand charge savings that the site host realizes monthly on their energy bills.   Green Charge Networks is aggregating these locations to participate in demand response programs.  The financing structure provides the site host with a zero-down, no cost turnkey energy storage solution with cost-savings and revenue-generating opportunities.",60.0,,,,34.0,0.0,,"Electric Bill Management, ",Whittier,California,United States,DD.01.YYYY,,,,CAISO,Southern California Edison (SCE),Investor Owned,Secondary Distribution,,Green Charge Networks,10.0,,0.0,0.0,,,,0.0,0.0,0.0,0.0,1.0,0.0,0.0,0.0,0.0,0.0,0.0,0.0,0.0,0.0,0.0,0.0,0.0,0.0,0.0,0.0,0.0,0.0,0.0,0.0,0.0,0.0,0.0,0.0,0.0
1195,Green Charge Networks GreenStation Announced 15,Electro-chemical,Lithium-ion Battery,Lithium-ion Battery,Announced,"Green Charge Networks installed an intelligent energy storage system.  Under the financed model, Green Charge Networks shares in the demand charge savings that the site host realizes monthly on their energy bills.   Green Charge Networks is aggregating these locations to participate in demand response programs.  The financing structure provides the site host with a zero-down, no cost turnkey energy storage solution with cost-savings and revenue-generating opportunities.",200.0,,,,34.0,0.0,,"Electric Bill Management, ",Ventura,California,United States,DD.01.YYYY,,,,CAISO,Southern California Edison (SCE),Investor Owned,Secondary Distribution,,Green Charge Networks,10.0,,0.0,0.0,,,,0.0,0.0,0.0,0.0,1.0,0.0,0.0,0.0,0.0,0.0,0.0,0.0,0.0,0.0,0.0,0.0,0.0,0.0,0.0,0.0,0.0,0.0,0.0,0.0,0.0,0.0,0.0,0.0,0.0
1196,Green Charge Networks GreenStation Announced 16,Electro-chemical,Lithium-ion Battery,Lithium-ion Battery,Announced,"Green Charge Networks installed an intelligent energy storage system.  Under the financed model, Green Charge Networks shares in the demand charge savings that the site host realizes monthly on their energy bills.   Green Charge Networks is aggregating these locations to participate in demand response programs.  The financing structure provides the site host with a zero-down, no cost turnkey energy storage solution with cost-savings and revenue-generating opportunities.",200.0,,,,34.0,0.0,,"Electric Bill Management, ",Oxnard,California,United States,DD.01.YYYY,,,,CAISO,Southern California Edison (SCE),Investor Owned,Secondary Distribution,,Green Charge Networks,10.0,,0.0,0.0,,,,0.0,0.0,0.0,0.0,1.0,0.0,0.0,0.0,0.0,0.0,0.0,0.0,0.0,0.0,0.0,0.0,0.0,0.0,0.0,0.0,0.0,0.0,0.0,0.0,0.0,0.0,0.0,0.0,0.0
1197,Green Charge Networks GreenStation Announced 17,Electro-chemical,Lithium-ion Battery,Lithium-ion Battery,Announced,"Green Charge Networks installed an intelligent energy storage system.  Under the financed model, Green Charge Networks shares in the demand charge savings that the site host realizes monthly on their energy bills.   Green Charge Networks is aggregating these locations to participate in demand response programs.  The financing structure provides the site host with a zero-down, no cost turnkey energy storage solution with cost-savings and revenue-generating opportunities.",400.0,,,,34.0,0.0,,"Electric Bill Management, ",Moorpark,California,United States,DD.01.YYYY,,,,CAISO,Southern California Edison (SCE),Investor Owned,Secondary Distribution,,Green Charge Networks,10.0,,0.0,0.0,,,,0.0,0.0,0.0,0.0,1.0,0.0,0.0,0.0,0.0,0.0,0.0,0.0,0.0,0.0,0.0,0.0,0.0,0.0,0.0,0.0,0.0,0.0,0.0,0.0,0.0,0.0,0.0,0.0,0.0
1198,Green Charge Networks GreenStation Announced 18,Electro-chemical,Lithium-ion Battery,Lithium-ion Battery,Announced,"Green Charge Networks installed an intelligent energy storage system.  Under the financed model, Green Charge Networks shares in the demand charge savings that the site host realizes monthly on their energy bills.   Green Charge Networks is aggregating these locations to participate in demand response programs.  The financing structure provides the site host with a zero-down, no cost turnkey energy storage solution with cost-savings and revenue-generating opportunities.",90.0,,,,32.715637199999996,-117.17,,"Electric Bill Management, ",San Diego,California,United States,27.01.2015,,,,CAISO,San Diego Gas &amp;amp; Electric (SDG&amp;amp;E),Investor Owned,Secondary Distribution,,Green Charge Networks,10.0,,0.0,0.0,,,,0.0,0.0,0.0,0.0,1.0,0.0,0.0,0.0,0.0,0.0,0.0,0.0,0.0,0.0,0.0,0.0,0.0,0.0,0.0,0.0,0.0,0.0,0.0,0.0,0.0,0.0,0.0,0.0,0.0
1202,Qinous Demonstrator Site - Lithium-Ion ,Electro-chemical,Lithium-ion Battery,Lithium Manganese Oxide Battery,Operational,"Qinous Mini Grid Demonstrator including: Simulator for Load &amp;amp; PV/Wind (100kW each), 150kW Diesel Genset, 100kW/112kWh Lithium Ion Energy Storage Solution incl. Site-Controller, 30kW/80kWh Aqueous Hybrid Ion Battery.",100.0,,,,52.0,0.0,,"Microgrid Capability, ",Berlin,Berlin,Germany,,31.08.2014,30.07.2014,,,,,,,,0.0,,0.0,0.0,,,DD.34.YYYY 23:34:05,0.0,0.0,0.0,0.0,0.0,0.0,0.0,0.0,0.0,0.0,0.0,0.0,0.0,0.0,1.0,0.0,0.0,0.0,0.0,0.0,0.0,0.0,0.0,0.0,0.0,0.0,0.0,0.0,0.0
1203,EEBatt - Energy Neighbor Pilot Project,Electro-chemical,Lithium-ion Battery,Lithium Iron Phosphate Battery,Operational,The Research Project EEBatt “Distributed stationary battery storage systems for the efficient use of renewable energies and support of grid stability” is a multidisciplinary project run by the TUM’s Munich School of Engineering (MSE).,249.0,,,,47.0,0.0,,"Electric Energy Time Shift, Grid-Connected Commercial (Reliability &amp; Quality), Grid-Connected Residential (Reliability), Microgrid Capability, Onsite Renewable Generation Shifting, ",Eastern,Bavaria,Germany,01.01.2013,19.10.2015,01.09.2015,,,,,Secondary Distribution,10-kV substation &amp; 290 kW PV Systems,Technical Universitiy of Munich,4.0,,0.0,0.0,Bavarian Center for Applied Energy Research (ZAE Bayern),"ZAE Bayern works on the interface between evidence-based fundamental and applied- industrial research. Every year the institute performs a great number of projects with the industry, from SME to large groups, as well as with university and non-university research partners. The most important themes of research at ZAE Bayern are to encourage the use of renewable energy and increasing the energy efficiency.",DD.20.YYYY 01:20:29,0.0,0.0,0.0,0.0,0.0,0.0,1.0,0.0,0.0,0.0,0.0,1.0,1.0,0.0,1.0,0.0,1.0,0.0,0.0,0.0,0.0,0.0,0.0,0.0,0.0,0.0,0.0,0.0,0.0
1204,IHEM - Intelligent HomeEnergyManagement,Electro-chemical,Lithium-ion Battery,Lithium-ion Battery,Operational,"In the compound project the use of stationary energy systems in intelligent home energy management systems is being researched, developed and evaluated. Possible synergies of the thermal and electrical object supply are utilized with the support of predicative operating strategies. The system contains distributed generation and consumption for the energy supply of residential homes such as photovoltaics, energy storage systems, solar thermal units, heating units, cogeneration units, heat storage systems and control units at the system systems level. The objective is an efficient operation of the considered system with a maximum utilization of renewable energies under consideration of reasonable business models. The part of TUM focuses on the battery system and includes, among others: •	Development of operating strategies for the battery system •	System simulation and design of the battery system •	Lifetime tests on single battery cells •	Construction of a prototypical battery system and deployment in a demonstrator system",3.0,,,,48.1440989,11.57,,"Grid-Connected Residential (Reliability), Microgrid Capability, Onsite Renewable Generation Shifting, ",Munich,Bavaria,Germany,01.07.2014,,,,,,,,,,20.0,,0.0,0.0,,,,0.0,0.0,0.0,0.0,0.0,0.0,0.0,0.0,0.0,0.0,0.0,0.0,1.0,0.0,1.0,0.0,1.0,0.0,0.0,0.0,0.0,0.0,0.0,0.0,0.0,0.0,0.0,0.0,0.0
1205,County of Santa Barbara Green Charge Networks GreenStation,Electro-chemical,Lithium-ion Battery,Lithium-ion Battery,Operational,"Green Charge Networks installed an intelligent energy storage system with a DC Fast Charger (electric vehicles).  Under the financed model, Green Charge Networks shares in the demand charge savings that the site host realizes monthly on their energy bills.  The model provides the site host with a zero-down, no cost turnkey energy storage and EV charging solution.  Green Charge Networks is aggregating these locations to participate in demand response programs.",30.0,,,,34.0,0.0,,"Electric Bill Management, ",Santa Barbara,California,United States,27.01.2015,,,,CAISO,Southern California Edison (SCE),Investor Owned,Secondary Distribution,,Green Charge Networks,10.0,,0.0,0.0,,,,0.0,0.0,0.0,0.0,1.0,0.0,0.0,0.0,0.0,0.0,0.0,0.0,0.0,0.0,0.0,0.0,0.0,0.0,0.0,0.0,0.0,0.0,0.0,0.0,0.0,0.0,0.0,0.0,0.0
1206,Oak Park USD - Brookside Elementary School Green Charge Networks GreenStation,Electro-chemical,Lithium-ion Battery,Lithium-ion Battery,Operational,"Green Charge Networks installed an intelligent energy storage system with a DC Fast Charger (electric vehicles).  Under the financed model, Green Charge Networks shares in the demand charge savings that the site host realizes monthly on their energy bills.  The model provides the site host with a zero-down, no cost turnkey energy storage and EV charging solution.  Green Charge Networks is aggregating these locations to participate in demand response programs.",60.0,,,,34.172629799999996,-118.76,,"Electric Bill Management, ",Oak Park,California,United States,27.01.2015,,,,CAISO,Southern California Edison (SCE),Investor Owned,Secondary Distribution,,Green Charge Networks,10.0,,0.0,0.0,,,,0.0,0.0,0.0,0.0,1.0,0.0,0.0,0.0,0.0,0.0,0.0,0.0,0.0,0.0,0.0,0.0,0.0,0.0,0.0,0.0,0.0,0.0,0.0,0.0,0.0,0.0,0.0,0.0,0.0
1207,California Fresh Market Green Charge Networks GreenStation,Electro-chemical,Lithium-ion Battery,Lithium-ion Battery,Operational,"Green Charge Networks installed an intelligent energy storage system with a DC Fast Charger (electric vehicles).  Under the financed model, Green Charge Networks shares in the demand charge savings that the site host realizes monthly on their energy bills.  The model provides the site host with a zero-down, no cost turnkey energy storage and EV charging solution.  Green Charge Networks is aggregating these locations to participate in demand response programs.",30.0,,,,35.0,0.0,,"Electric Bill Management, ",Solvang,California,United States,27.01.2015,,,,CAISO,Pacific Gas &amp;amp; Electric (PG&amp;amp;E),Investor Owned,Secondary Distribution,,Green Charge Networks,10.0,,0.0,0.0,,,,0.0,0.0,0.0,0.0,1.0,0.0,0.0,0.0,0.0,0.0,0.0,0.0,0.0,0.0,0.0,0.0,0.0,0.0,0.0,0.0,0.0,0.0,0.0,0.0,0.0,0.0,0.0,0.0,0.0
1208,MVLA High School District - Los Altos HS,Electro-chemical,Lithium-ion Battery,Lithium-ion Battery,Operational,"Green Charge Networks installed an intelligent energy storage system with a DC Fast Charger (electric vehicles).  Under the financed model, Green Charge Networks shares in the demand charge savings that the site host realizes monthly on their energy bills.  The model provides the site host with a zero-down, no cost turnkey energy storage and EV charging solution.  Green Charge Networks is aggregating these locations to participate in demand response programs.",200.0,,,,37.0,0.0,,"Demand Response, Electric Bill Management, ",Los Altos,California,United States,27.01.2015,,,,CAISO,Pacific Gas &amp;amp; Electric (PG&amp;amp;E),Investor Owned,Secondary Distribution,,Green Charge Networks,10.0,,0.0,0.0,,,DD.13.YYYY 18:13:20,0.0,1.0,0.0,0.0,1.0,0.0,0.0,0.0,0.0,0.0,0.0,0.0,0.0,0.0,0.0,0.0,0.0,0.0,0.0,0.0,0.0,0.0,0.0,0.0,0.0,0.0,0.0,0.0,0.0
1209,Kaiser Permanente San Rafael Green Charge Networks GreenStation,Electro-chemical,Lithium-ion Battery,Lithium-ion Battery,Operational,"Green Charge Networks installed an intelligent energy storage system with a DC Fast Charger (electric vehicles).  Under the financed model, Green Charge Networks shares in the demand charge savings that the site host realizes monthly on their energy bills.  The model provides the site host with a zero-down, no cost turnkey energy storage and EV charging solution.  Green Charge Networks is aggregating these locations to participate in demand response programs.",30.0,,,,38.0,0.0,,"Electric Bill Management, ",San Rafael,California,United States,27.01.2015,,,,CAISO,Pacific Gas &amp;amp; Electric (PG&amp;amp;E),Investor Owned,Secondary Distribution,,Green Charge Networks,10.0,,0.0,0.0,,,,0.0,0.0,0.0,0.0,1.0,0.0,0.0,0.0,0.0,0.0,0.0,0.0,0.0,0.0,0.0,0.0,0.0,0.0,0.0,0.0,0.0,0.0,0.0,0.0,0.0,0.0,0.0,0.0,0.0
1210,Green Charge Networks GreenStation Announced 1,Electro-chemical,Lithium-ion Battery,Lithium-ion Battery,Announced,"Green Charge Networks installed an intelligent energy storage system.  Under the financed model, Green Charge Networks shares in the demand charge savings that the site host realizes monthly on their energy bills.   Green Charge Networks is aggregating these locations to participate in demand response programs.  The financing structure provides the site host with a zero-down, no cost turnkey energy storage solution with cost-savings and revenue-generating opportunities.",120.0,,,,37.0,0.0,,"Electric Bill Management, ",Fresno,California,United States,DD.01.YYYY,,,,CAISO,Pacific Gas &amp;amp; Electric (PG&amp;amp;E),Investor Owned,Secondary Distribution,,Green Charge Networks,10.0,,0.0,0.0,,,,0.0,0.0,0.0,0.0,1.0,0.0,0.0,0.0,0.0,0.0,0.0,0.0,0.0,0.0,0.0,0.0,0.0,0.0,0.0,0.0,0.0,0.0,0.0,0.0,0.0,0.0,0.0,0.0,0.0
1211,Green Charge Networks GreenStation Announced 2,Electro-chemical,Lithium-ion Battery,Lithium-ion Battery,Announced,"Green Charge Networks installed an intelligent energy storage system.  Under the financed model, Green Charge Networks shares in the demand charge savings that the site host realizes monthly on their energy bills.   Green Charge Networks is aggregating these locations to participate in demand response programs.  The financing structure provides the site host with a zero-down, no cost turnkey energy storage solution with cost-savings and revenue-generating opportunities.",60.0,,,,37.0,0.0,,"Electric Bill Management, ",Fresno,California,United States,DD.01.YYYY,,,,CAISO,Pacific Gas &amp;amp; Electric (PG&amp;amp;E),Investor Owned,Secondary Distribution,,Green Charge Networks,10.0,,0.0,0.0,,,,0.0,0.0,0.0,0.0,1.0,0.0,0.0,0.0,0.0,0.0,0.0,0.0,0.0,0.0,0.0,0.0,0.0,0.0,0.0,0.0,0.0,0.0,0.0,0.0,0.0,0.0,0.0,0.0,0.0
1212,Green Charge Networks GreenStation Announced 3,Electro-chemical,Lithium-ion Battery,Lithium-ion Battery,Announced,"Green Charge Networks installed an intelligent energy storage system.  Under the financed model, Green Charge Networks shares in the demand charge savings that the site host realizes monthly on their energy bills.   Green Charge Networks is aggregating these locations to participate in demand response programs.  The financing structure provides the site host with a zero-down, no cost turnkey energy storage solution with cost-savings and revenue-generating opportunities.",60.0,,,,37.0,0.0,,"Electric Bill Management, ",Fresno,California,United States,DD.01.YYYY,,,,CAISO,Pacific Gas &amp;amp; Electric (PG&amp;amp;E),Investor Owned,Secondary Distribution,,Green Charge Networks,10.0,,0.0,0.0,,,,0.0,0.0,0.0,0.0,1.0,0.0,0.0,0.0,0.0,0.0,0.0,0.0,0.0,0.0,0.0,0.0,0.0,0.0,0.0,0.0,0.0,0.0,0.0,0.0,0.0,0.0,0.0,0.0,0.0
1213,Green Charge Networks GreenStation Announced 4,Electro-chemical,Lithium-ion Battery,Lithium-ion Battery,Announced,"Green Charge Networks installed an intelligent energy storage system.  Under the financed model, Green Charge Networks shares in the demand charge savings that the site host realizes monthly on their energy bills.   Green Charge Networks is aggregating these locations to participate in demand response programs.  The financing structure provides the site host with a zero-down, no cost turnkey energy storage solution with cost-savings and revenue-generating opportunities.",60.0,,,,37.0,0.0,,"Electric Bill Management, ",Fresno,California,United States,DD.01.YYYY,,,,CAISO,Pacific Gas &amp;amp; Electric (PG&amp;amp;E),Investor Owned,Secondary Distribution,,Green Charge Networks,10.0,,0.0,0.0,,,,0.0,0.0,0.0,0.0,1.0,0.0,0.0,0.0,0.0,0.0,0.0,0.0,0.0,0.0,0.0,0.0,0.0,0.0,0.0,0.0,0.0,0.0,0.0,0.0,0.0,0.0,0.0,0.0,0.0
1214,Younicos and Vattenfall Project: Lithium Ion,Electro-chemical,Lithium-ion Battery,Lithium-ion Battery,Operational,"In a joint pilot project, Younicos and Vattenfall have commissioned the first large-scale battery to be integrated in the European electricity balancing market. Since the end of 2012, a 1 megawatt sodium-sulfur battery based at the Younicos headquarters in Berlin-Adlershof successfully balances short-term fluctuations in the power grid. This is the first time a battery is employed in maintaining the mains power frequency of the transmission system operator 50 Hertz Transmission GmbH.  The hybrid battery consists of a 1 MW/6 MWh sodium sulfur unit and 200 kW/200 kWh lithium-ion unit.",200.0,,,,52.42726,13.55,,"Frequency Regulation, ",Berlin,Berlin,Germany,,01.12.2012,,,,Vattenfall,Federally Owned,Secondary Distribution,,Younicos,20.0,,0.0,0.0,,,DD.16.YYYY 00:16:08,0.0,0.0,0.0,0.0,0.0,0.0,0.0,0.0,0.0,0.0,1.0,0.0,0.0,0.0,0.0,0.0,0.0,0.0,0.0,0.0,0.0,0.0,0.0,0.0,0.0,0.0,0.0,0.0,0.0
1215,Korea Electrotechnology Research Institute 250 kW,Electro-chemical,Lithium-ion Battery,Lithium Polymer Battery,Operational,"This is a part of a project of &quot;Research on Demand Response with Public Institution Demonstration Program.&quot; The system is composed of 250 kW / 426 kWh ESS with EMS.  In order to reduce the national peak demand of electricity, the main concept of the PEAK SHAVING has to be smarter. This project focuses on the customers and demand management under government&#039;s control interactively.  The system allows the customers to shave their peak and additionally to move their peak, thus managing their demand by using an EMS. The EMS interacts with the national server and reports the real-time-status of institutes&#039; energy via ethernet. ICT technology has combined with the EMS and anticipates customer&#039;s peak usages and does the electrical bill management by reducing and moving its peak. Once this algorithm and the system has set to be standard in a year and is accepted by government, the system will be adapted nationwide for public institutions and other customers.",250.0,,,,35.0,0.0,,"Electric Bill Management, ",Changwon,Gyeongnam,"Korea, South",,22.02.2014,,,,,Public Owned,,,SmartGrid.or.kr,0.0,,0.0,0.0,,,DD.39.YYYY 13:39:00,0.0,0.0,0.0,0.0,1.0,0.0,0.0,0.0,0.0,0.0,0.0,0.0,0.0,0.0,0.0,0.0,0.0,0.0,0.0,0.0,0.0,0.0,0.0,0.0,0.0,0.0,0.0,0.0,0.0
1218,Terna Grid Defense Plan Phase II (1),Electro-chemical,Lithium-ion Battery,Lithium-ion Battery,Announced,The project goal is to increase the security of electricity systems in Sicily and Sardinia with the installation of storage systems for a total 40 MW capacity.,20000.0,,,,37.5999938,14.02,,"Frequency Regulation, Transmission upgrades due to wind, Transmission Support, Voltage Support, ",Codrongianos and Casuzze,Sardinia and Sicily,Italy,02.10.2012,,,,,Terna,Investor Owned,Transmission,,,12.0,,0.0,0.0,,,DD.30.YYYY 14:30:08,0.0,0.0,0.0,0.0,0.0,0.0,0.0,0.0,0.0,0.0,1.0,0.0,0.0,0.0,0.0,0.0,0.0,0.0,0.0,0.0,0.0,0.0,0.0,1.0,0.0,1.0,0.0,0.0,1.0
1222,"Terna Storage Lab 2, Sicily (2)",Electro-chemical,Lithium-ion Battery,Lithium Nickel Cobalt Aluminum Battery,Operational,"The project goal is to increase the security of electricity systems in Sicily and Sardinia with the installation of storage systems for a total 40 MW capacity. The project is divided into two phases. Phase 1, called “Storage Lab”, plans the installation of two multi-technology power plants (different storage technologies and at least 8 different commercial products) for a total 16 MW in Sicily and Sardinia. Based on the results of phase 1, additional 24 MW will be installed with the use of the most promising technologies. The Storage Lab batteries will be supplied by Italian and foreign companies. Storage Lab will not only support for the safe management of the electricity grid, but also host activities to develop Smart Grid applications. Italian and foreign universities and research centers will be part of such challenging activities.",900.0,,,,38.0,0.0,,"Frequency Regulation, Electric Supply Reserve Capacity - Spinning, Voltage Support, Transmission Support, Black Start, ",Ciminna,Sicily,Italy,02.10.2012,01.02.2015,23.05.2014,,,Terna S.p.A.,Investor Owned,Transmission,,,12.0,,0.0,0.0,,,DD.49.YYYY 16:49:20,1.0,0.0,0.0,0.0,0.0,0.0,0.0,0.0,0.0,1.0,1.0,0.0,0.0,0.0,0.0,0.0,0.0,0.0,0.0,0.0,0.0,0.0,0.0,1.0,0.0,0.0,0.0,0.0,1.0
1227,NICE GRID project in Carros (Southern France): Low Voltage Grid Batteries (LVGB),Electro-chemical,Lithium-ion Battery,Lithium-ion Battery,Operational,"The NICE GRID project brings together a broad range of stakeholders under the coordination of the French DSO ERDF, and is located in Carros, near Nice in the French Riviera. The goal is to develop a smart grid that effectively integrates a high proportion of solar panels, energy storage batteries and smart meters. The distribution grid within the city is managed by a Network Energy Manager (NEM) which identifies grid constraints on a day ahead basis and requests flexibilities to mitigate them. Grid batteries are one type of used flexibilities, and are managed by a Network Battery Agregator (NBA) There will be two Low Voltage Grid Batteries (LVGB) connected to the low voltage grid at around 400 m of the corresponding secondary substation, in order to maximize the effect of the storage asset on the feeder voltage curve. These storage assets are integrated in a 10 feet container: the PCS and the battery modules are in the same container. These containers are located on a client field and a site owned by the municipality.",33.0,,,,44.0,0.0,,"Onsite Renewable Generation Shifting, Stationary Transmission/Distribution Upgrade Deferral, ",Carros,Provence-Alpes-Côte d&#039;Azur,France,11.07.2011,15.09.2014,15.09.2014,,,Electricité Réseau Distribution France (ERDF),Public Owned,Secondary Distribution,Secondary Distribution,"ERDF, SOCOMEC",2.0,,150000.0,0.0,"ARMINES University, EDF R&amp;amp;D",,DD.36.YYYY 20:36:25,0.0,0.0,0.0,0.0,0.0,0.0,0.0,0.0,0.0,0.0,0.0,0.0,0.0,0.0,0.0,0.0,1.0,0.0,0.0,0.0,0.0,1.0,0.0,0.0,0.0,0.0,0.0,0.0,0.0
1228,NICE GRID project in Carros (Southern France): Secondary Substation Battery (SSB),Electro-chemical,Lithium-ion Battery,Lithium-ion Battery,Operational,"The NICE GRID project brings together a broad range of stakeholders under the coordination of the French DSO ERDF, and is located in Carros, near Nice in the French Riviera. The goal is to develop a smart grid that effectively integrates a high proportion of solar panels, energy storage batteries and smart meters. The distribution grid within the city is managed by a Network Energy Manager (NEM) which identifies grid constraints on a day ahead basis and requests flexibilities to mitigate them. Grid batteries are one type of used flexibilities, and are managed by a Network Battery Agregator (NBA) The Secondary Substation Battery (SSB) will be installed during autumn 2014 close to the secondary Substation of “Dock Trachel”. This secondary substation supplies a professional area of 12 clients, with around 250 kW  of peak consumption, and 430 kWp of PV installed capacity. The PCS of this storage asset will be located in the secondary substation building, whereas the battery container will be located on the car park of a commercial client. This asset will have islanding capabilities.",250.0,,,,43.792389,7.19,,"Microgrid Capability, Onsite Renewable Generation Shifting, Stationary Transmission/Distribution Upgrade Deferral, ",Carros,Provence-Alpes-Côte d&#039;Azur,France,11.07.2011,16.09.2014,16.09.2014,,,Electricité Réseau Distribution France (ERDF),Public Owned,Secondary Distribution,Secondary Distribution,"ERDF, SOCOMEC",2.0,,900000.0,0.0,"ARMINES University, EDF R&amp;amp;D",,DD.00.YYYY 22:00:11,0.0,0.0,0.0,0.0,0.0,0.0,0.0,0.0,0.0,0.0,0.0,0.0,0.0,0.0,1.0,0.0,1.0,0.0,0.0,0.0,0.0,1.0,0.0,0.0,0.0,0.0,0.0,0.0,0.0
1233,Clean Energy Storage: Steel Project,Electro-chemical,Lithium-ion Battery,Lithium Iron Phosphate Battery,Operational,Residential combination small wind and solar,5.0,,,,47.6062095,-122.33,,"Onsite Renewable Generation Shifting, Grid-Connected Residential (Reliability), Electric Bill Management with Renewables, On-Site Power, ",Seattle,Washington,United States,,,18.04.2014,,,Seattle City Light,Public Owned,,Renewables,,20.0,,0.0,0.0,,,DD.53.YYYY 22:53:35,0.0,0.0,0.0,0.0,0.0,1.0,0.0,0.0,0.0,0.0,0.0,0.0,1.0,0.0,0.0,1.0,1.0,0.0,0.0,0.0,0.0,0.0,0.0,0.0,0.0,0.0,0.0,0.0,0.0
1234,Clean Energy Storage: Devinenini,Electro-chemical,Lithium-ion Battery,Lithium Iron Phosphate Battery,Operational,Residential combination small wind and solar,5.0,,,,47.6062095,-122.33,,"Onsite Renewable Generation Shifting, Grid-Connected Residential (Reliability), Electric Bill Management with Renewables, On-Site Power, ",Seattle,Washington,United States,,,04.05.2014,,,Seattle City Light,Public Owned,,Renewables,,20.0,,0.0,0.0,,,DD.50.YYYY 00:50:31,0.0,0.0,0.0,0.0,0.0,1.0,0.0,0.0,0.0,0.0,0.0,0.0,1.0,0.0,0.0,1.0,1.0,0.0,0.0,0.0,0.0,0.0,0.0,0.0,0.0,0.0,0.0,0.0,0.0
